{
  "schema_version": "2.0",
  "video_id": "representation-decision",
  "episode_content_hash": "7f76b9abb51d49ee81009904a462ffdd29e5e037bd7a53a274fc4adcddd03bd1",
  "language": "en-US",
  "pace_wpm": 125.0,
  "word_count": 1082,
  "duration_target_s": 599.998,
  "cues": [
    {
      "cue_id": "q0001",
      "chapter_id": "c01",
      "scene_id": "s001",
      "role": "hook",
      "spoken": true,
      "text": "What should you ask before choosing CM, CSE-flat, packed evaluation, BDD, or SAT?",
      "pronunciation": {
        "CM": "C M",
        "CSE-flat": "C S E flat",
        "CSE": "C S E"
      },
      "claim_ids": [],
      "source_ids": [],
      "evidence_status": "conceptual",
      "timing_target_s": 7.728,
      "text_sha256": "5c57d7aabe1baabd3c167b2895887e10d0cd5dbce19b84f0ae10db9c0fa7bdb5"
    },
    {
      "cue_id": "q0002",
      "chapter_id": "c01",
      "scene_id": "s001",
      "role": "definition",
      "spoken": true,
      "text": "This episode has one job: Representation choice should follow the required output, live support, reuse, update pattern, exact operation, preparation budget, and evidence status.",
      "pronunciation": {},
      "claim_ids": [
        "dense-vs-ir-distinct",
        "no-universal-winner",
        "representation-decision-factors",
        "selector-no-width-rule"
      ],
      "source_ids": [
        "src-cm-build",
        "src-cm-ir",
        "src-correction-report",
        "src-epfl-report",
        "src-recognition-readme"
      ],
      "evidence_status": "confirmed",
      "timing_target_s": 10.397,
      "text_sha256": "3bf6fa903db96baf1457095ce8562de10f2dd0887a11f0224f8b00e1108866d8"
    },
    {
      "cue_id": "q0003",
      "chapter_id": "c01",
      "scene_id": "s001",
      "role": "definition",
      "spoken": true,
      "text": "We build on Configuration and feature-model workloads, Circuit workloads: structure, truth, and exact controls, Policy and rule systems with related revisions, Why one blended fastest-method chart is dishonest; their definitions stay fixed while this lesson adds a new layer.",
      "pronunciation": {},
      "claim_ids": [],
      "source_ids": [],
      "evidence_status": "conceptual",
      "timing_target_s": 10.397,
      "text_sha256": "9609c584674836e8aa976f668fb301b9c5d98c90fedce8a7437742e1d71119c1"
    },
    {
      "cue_id": "q0004",
      "chapter_id": "c01",
      "scene_id": "s002",
      "role": "definition",
      "spoken": true,
      "text": "Choose by the answer required, the work reused, the structure updated, and the costs included.",
      "pronunciation": {},
      "claim_ids": [
        "dense-vs-ir-distinct",
        "no-universal-winner",
        "representation-decision-factors",
        "selector-no-width-rule"
      ],
      "source_ids": [
        "src-cm-build",
        "src-cm-ir",
        "src-correction-report",
        "src-epfl-report",
        "src-recognition-readme"
      ],
      "evidence_status": "confirmed",
      "timing_target_s": 8.837,
      "text_sha256": "fbd2e420574c8875a32521d363bd95adedf28789ada3a379d3e96cfa9422688a"
    },
    {
      "cue_id": "q0005",
      "chapter_id": "c01",
      "scene_id": "s002",
      "role": "definition",
      "spoken": true,
      "text": "Watch for the label required output; it stays attached to the artifact this episode means.",
      "pronunciation": {},
      "claim_ids": [],
      "source_ids": [],
      "evidence_status": "conceptual",
      "timing_target_s": 8.837,
      "text_sha256": "f4633c4b17ef0c2100e1d71d55b22d815d3336f16a087e47adc1855fe3726732"
    },
    {
      "cue_id": "q0006",
      "chapter_id": "c01",
      "scene_id": "s002",
      "role": "definition",
      "spoken": true,
      "text": "When we say reuse pattern, the highlight identifies its layer before we interpret it.",
      "pronunciation": {},
      "claim_ids": [],
      "source_ids": [],
      "evidence_status": "conceptual",
      "timing_target_s": 8.283,
      "text_sha256": "075aa7a4578ec52643419ccb1463d659851b88172b2d0730ad8d4cf5fd50a618"
    },
    {
      "cue_id": "q0007",
      "chapter_id": "c01",
      "scene_id": "s003",
      "role": "definition",
      "spoken": true,
      "text": "The term update pattern receives its own visual state so it cannot drift into a neighboring concept.",
      "pronunciation": {},
      "claim_ids": [],
      "source_ids": [],
      "evidence_status": "conceptual",
      "timing_target_s": 9.946,
      "text_sha256": "7485c0998c6379fade5eb73cdf42e8f52b20ef14330dd7047b4afe8c5d1cefcf"
    },
    {
      "cue_id": "q0008",
      "chapter_id": "c01",
      "scene_id": "s003",
      "role": "definition",
      "spoken": true,
      "text": "We will keep preparation budget visible whenever its definition controls the inference.",
      "pronunciation": {},
      "claim_ids": [],
      "source_ids": [],
      "evidence_status": "conceptual",
      "timing_target_s": 7.174,
      "text_sha256": "c447bc05da494eb9da74a3ef732795abfc392ee75cd94ee3f3ed86f612c04c33"
    },
    {
      "cue_id": "q0009",
      "chapter_id": "c01",
      "scene_id": "s003",
      "role": "definition",
      "spoken": true,
      "text": "A persistent evidence status label marks exactly where that object enters the example.",
      "pronunciation": {},
      "claim_ids": [],
      "source_ids": [],
      "evidence_status": "conceptual",
      "timing_target_s": 7.728,
      "text_sha256": "879a57c2da72b774c02b5f219563d78cd547ed4290f39bca3803027cad403f3b"
    },
    {
      "cue_id": "q0010",
      "chapter_id": "c02",
      "scene_id": "s004",
      "role": "example",
      "spoken": true,
      "text": "The next sequence uses Versioned feature model as a conceptual teaching example, not as measured benchmark evidence.",
      "pronunciation": {},
      "claim_ids": [],
      "source_ids": [
        "src-recognition-readme"
      ],
      "evidence_status": "conceptual",
      "timing_target_s": 9.946,
      "text_sha256": "6a4ab572760c20c036fcb65196a94170c3e817a771f5fd7e801bfbdee7636c73"
    },
    {
      "cue_id": "q0011",
      "chapter_id": "c02",
      "scene_id": "s004",
      "role": "example",
      "spoken": true,
      "text": "Our stable example is Versioned feature model.",
      "pronunciation": {},
      "claim_ids": [],
      "source_ids": [
        "src-recognition-readme"
      ],
      "evidence_status": "conceptual",
      "timing_target_s": 4.401,
      "text_sha256": "8df28b2829359cdce0d809abc92d512da11af14c1c79eb549d967378145bd990"
    },
    {
      "cue_id": "q0012",
      "chapter_id": "c02",
      "scene_id": "s004",
      "role": "example",
      "spoken": true,
      "text": "A conceptual product family with Core, Cloud, Local, Analytics, and Export features plus requires/excludes constraints and three adjacent revisions.",
      "pronunciation": {},
      "claim_ids": [],
      "source_ids": [
        "src-recognition-readme"
      ],
      "evidence_status": "conceptual",
      "timing_target_s": 10.397,
      "text_sha256": "a6fe384b9636b3911b545d34d38621332c2498541eee8b33d081afcd29702a60"
    },
    {
      "cue_id": "q0013",
      "chapter_id": "c02",
      "scene_id": "s005",
      "role": "example",
      "spoken": true,
      "text": "Teach constraints, revisions, invalidation, and repeated queries without borrowing an unsupported product claim.",
      "pronunciation": {},
      "claim_ids": [],
      "source_ids": [
        "src-recognition-readme"
      ],
      "evidence_status": "conceptual",
      "timing_target_s": 7.728,
      "text_sha256": "2b8af0253c6b9c2c3f021b981e98f8930b46d4443ec181e1066da981edb311fe"
    },
    {
      "cue_id": "q0014",
      "chapter_id": "c02",
      "scene_id": "s005",
      "role": "mechanism",
      "spoken": true,
      "text": "We now construct the Versioned feature model and name every part before interpreting it.",
      "pronunciation": {},
      "claim_ids": [
        "dense-vs-ir-distinct",
        "no-universal-winner",
        "representation-decision-factors",
        "selector-no-width-rule"
      ],
      "source_ids": [
        "src-cm-build",
        "src-cm-ir",
        "src-correction-report",
        "src-epfl-report",
        "src-recognition-readme"
      ],
      "evidence_status": "conceptual",
      "timing_target_s": 8.283,
      "text_sha256": "703702e64e21f0ac3d10a7de2fb14fe8a4201c78a7ca3d0d39e2d760178d56ab"
    },
    {
      "cue_id": "q0015",
      "chapter_id": "c02",
      "scene_id": "s005",
      "role": "mechanism",
      "spoken": true,
      "text": "Now isolate representation decision flow inside Versioned feature model.",
      "pronunciation": {},
      "claim_ids": [],
      "source_ids": [],
      "evidence_status": "conceptual",
      "timing_target_s": 5.51,
      "text_sha256": "793725cab37b465a60f6c6618117f51ef9de04cf381eaedbed9f0a4e63093be2"
    },
    {
      "cue_id": "q0016",
      "chapter_id": "c02",
      "scene_id": "s006",
      "role": "mechanism",
      "spoken": true,
      "text": "The example definition and output meaning stay fixed while only the state for representation decision flow changes.",
      "pronunciation": {},
      "claim_ids": [],
      "source_ids": [
        "src-recognition-readme"
      ],
      "evidence_status": "conceptual",
      "timing_target_s": 9.946,
      "text_sha256": "986798f8664868834143c0a1f63f7518137bd565eadab31e3ab1a278fa76d615"
    },
    {
      "cue_id": "q0017",
      "chapter_id": "c02",
      "scene_id": "s006",
      "role": "mechanism",
      "spoken": true,
      "text": "That matched before-and-after view assigns the visible consequence to representation decision flow, not to a substituted workload.",
      "pronunciation": {},
      "claim_ids": [],
      "source_ids": [],
      "evidence_status": "conceptual",
      "timing_target_s": 9.946,
      "text_sha256": "f8b8c705a0761622330d919e95e6fcd41157037e792eb16217ff3217d7bc9b64"
    },
    {